<?xml version="1.0" standalone="no" ?>
<!DOCTYPE scene SYSTEM "scene.dtd">

<scene output_file="cook_torrance.png">
    <background_color r="0.0" g="0.0" b="0.0"/>
    <camera>
        <position x="1.0" y="4.0" z="-1.0"/>
        <lookat x="0.0" y="0.0" z="-4.0"/>
        <up x="0.0" y="1.0" z="0.0"/>
        <horizontal_fov angle="45"/>
        <resolution horizontal="1024" vertical="1024"/>
        <max_bounces n="8"/>
    </camera>
    <lights>
        <ambient_light>
            <color r="1.0" g="1.0" b="1.0"/>
        </ambient_light>
        <point_light>
            <color r="0.7" g="0.7" b="0.7"/>
            <position x="2.0" y="3.0" z="-2.5"/>
        </point_light>
        <point_light>
            <color r="0.7" g="0.7" b="0.7"/>
            <position x="-2.0" y="3.0" z="-2.5"/>
        </point_light>
    </lights>
    <surfaces>
        <sphere radius="1.0">
            <position x="1.5" y="0.0" z="-2.4"/>
            <material_textured>
                <texture name="mramor6x6.png"/>
                <cook_torrance ka="0.3" ks="0.6" roughness="0.25"/>
                <reflectance r="0.0"/>
                <transmittance t="0.0"/>
                <refraction iof="0.0"/>
            </material_textured>
        </sphere>
        <sphere radius="1.0">
            <position x="-1.0" y="0.5" z="-3.4"/>
            <material_solid>
                <color r="0.95" g="0.63" b="0.01"/>
                <cook_torrance ka="0.3" ks="0.7" roughness="0.4"/>
                <reflectance r="0.0"/>
                <transmittance t="0.0"/>
                <refraction iof="0.0"/>
            </material_solid>
        </sphere>
        <mesh name="open_room.obj">
            <material_textured>
                <texture name="MarbleBeige.png"/>
                <cook_torrance ka="0.3" ks="0.3" roughness="0.6"/>
                <reflectance r="0.0"/>
                <transmittance t="0.0"/>
                <refraction iof="0.0"/>
            </material_textured>
        </mesh>
    </surfaces>
</scene>
